source,title,description,content,published_at,keyword_used,url
NPR,"U.S. evacuates diplomats from Middle East. And, what to expect from N.C., Texas primaries","The U.S. has evacuated diplomats in the Middle East and closed several embassies as war in Iran intensifies. And, what to expect from the Senate races in the North Carolina and Texas primary elections.","Good morning. You're reading the Up First newsletter. Subscribe here to get it delivered to your inbox, and listen to the Up First podcast for all the news you need to start your day.
Today's top st… [+6825 chars]",2026-03-03T12:36:29Z,Iran Israel war,https://www.npr.org/2026/03/03/g-s1-112278/up-first-newsletter-iran-us-israel-middle-east-nc-texas-primaries-kristi-noem-bill-clinton
Business Insider,Iranian drone and missile activity has dropped sharply as the US pushes to expand air superiority,"Iran's theater ballistic missile shots fired are down 86%, with a 23% decrease in the last 24 hours, the top US general said.","Iran's missile and drone launches have decreased significantly since the US and Israel began a widespread strike campaign against the country, the top American general said on Wednesday.
Gen. Dan Ca… [+3616 chars]",2026-03-04T15:15:48Z,Iran Israel war,https://www.businessinsider.com/iran-drone-missile-activity-drops-us-pushes-for-air-superiority-2026-3
The New Yorker,Sheltering in Jerusalem and Looking at the Iran War,"Bernard Avishai on how the U.S.-Israeli military engagement against Iran affects residents of Jerusalem, who scramble to take shelter from the Islamic Republic’s counterattacks.","The missile program is another matter. Irans conventional warheads pose no imminent threat to the U.S., and their threat to U.S. bases and allies in the Gulf, which has become lethal since the start … [+5169 chars]",2026-03-13T18:45:03Z,Iran Israel war,https://www.newyorker.com/news/the-lede/sheltering-in-jerusalem-and-looking-at-the-iran-war
Abcnews.com,Middle East braces for conflict but uncertainty remains over Trump's final decision,"The U.S. and Iran held face-to-face talks in Geneva on Thursday, but a huge military build-up of U.S. forces in the Middle East has the region bracing for war.","The United States and Iran held face-to-face talks in Geneva on Thursday, but a huge military build-up of U.S. forces in the Middle East has the region bracing for a second major war in under a year.… [+6287 chars]",2026-02-26T21:11:13Z,Iran Israel war,https://abcnews.com/International/middle-east-braces-conflict-uncertainty-remains-trumps-final/story?id=130526473
NPR,"With U.S. forces in position, Trump mulls his options for Iran","President Trump says he hasn't decided whether to attack Iran. While he weighs his options, a military buildup over the past month means the U.S. now has an expansive presence in the region.","President Trump says he hasn't decided whether he'll launch a military strike on Iran. But he now has a wide range of options.
An American military buildup over the past month means the U.S. now has… [+5627 chars]",2026-02-21T11:00:00Z,Iran Israel war,https://www.npr.org/2026/02/21/nx-s1-5720966/trump-iran
NPR,"USS Ford has seen war, fire and plumbing woes as it nears a record long deployment","The Ford's crew left Norfolk, Va., on June 24, initially bound for the Mediterranean. More than nine months later, the crew is now in the Red Sea for the war with Iran with no clear return date.","After moving to the Red Sea to participate in operations against Iran, the USS Gerald R. Ford, the U.S.' newest and largest aircraft carrier, is approaching a record breaking deployment.
The Ford is… [+8073 chars]",2026-03-17T21:29:09Z,Iran Israel war,https://www.npr.org/2026/03/17/nx-s1-5746006/uss-ford-iran
Abcnews.com,WATCH: Senate fails to advance Iran war powers resolution,The Senate on Wednesday rejected a Democratic-led Iran war powers resolution that called for congressional approval for military action against Iran. ABC News' Jay O'Brien reports from Capitol Hill.,"<ul><li>US torpedoes Iranian warship as war with Iran spreads
</li><li>1st charter flight with Americans by State Department leaves Middle East
</li><li>Senate vote fails to advance Iran war powers… [+4449 chars]",2026-03-05T02:11:46Z,Iran Israel war,https://abcnews.com/video/130775502/
Abcnews.com,Tens of thousands stranded in the Middle East as Iran war complicates routes home,Tens of thousands of people are stranded across the Middle East as the Iran war spreads throughout the region,"BERLIN -- Tens of thousands of people, from Romanian religious pilgrims to tourists and diplomats' family members, are stranded across the Middle East as the Iran war spreads throughout the region.
… [+4246 chars]",2026-03-03T13:33:22Z,Iran Israel war,https://abcnews.com/International/wireStory/tens-thousands-people-stranded-middle-east-iran-war-130709038
Business Insider,Strikes on Iran have disrupted one of the world's busiest flight corridors,"Following US and Israeli strikes, Iran and neighbor nations closed airspace, impacting airlines like Qatar Airways and Emirates.","Iran and the Persian Gulf is home to some of the world's busiest airspace.Flightradar24
<ul><li>The US and Israel launched strikes on Iran on Saturday morning.</li><li>Flight-tracking data showed fl… [+2310 chars]",2026-02-28T10:34:36Z,Iran Israel India,https://www.businessinsider.com/strikes-on-iran-flights-canceled-diverted-busiest-airspace-2026-2
BBC News,India offered sanctuary to Iranian ship three days before US sank it,India says Tehran sought permission to dock three ships on the day the US and Israel began a war on Iran.,"The sinking of the Iris Dena, with 130 sailors on board, in international waters off Sri Lanka's southern coast on 4 March marked a dramatic widening of the war - and raised questions about India's a… [+24 chars]",2026-03-09T12:04:29Z,Iran Israel India,https://www.bbc.com/news/articles/c2e4yxj0pd3o
The Verge,AI is now part of the culture wars — and real wars,"Hello and welcome to Regulator, the newsletter for Verge subscribers that goes inside Washington's increasingly existential clashes between tech and politics. If this was forwarded to you, can I interest you in a full-fledged subscription to The Verge for onl…","<ul><li></li><li></li><li></li></ul>
Untangling the Anthropic-PentagonOpenAI-Iran news cycle.
Untangling the Anthropic-PentagonOpenAI-Iran news cycle.
by
Tina NguyenClose
Senior Reporter, Washin… [+11805 chars]",2026-03-04T14:15:03Z,Iran Israel India,https://www.theverge.com/column/888907/ai-culture-war-iran-pentagon-anthropic
Business Insider,Airlines are being squeezed into this sliver of sky as much of the Middle East joins Russia on the airspace no-fly list,"Flightradar24 shows flights being funneled into narrow corridors north of Iran, or forced into longer detours over Saudi Arabia and other regions.","Airlines that can't use Russian — and now Iranian airspace — are funneling through the Caucasus corridor. The region also saw increased traffic during previous Iranian conflicts.Flightradar24
<ul><l… [+6945 chars]",2026-03-02T20:58:15Z,Iran Israel India,https://www.businessinsider.com/airlines-are-using-narrow-corridor-to-skirt-closed-airspace-2026-3
NPR,The 2026 World Cup faces big challenges with only 100 days to go,"Will Iran compete? Will violence in Mexico flare up? And what about funding for host cities in the U.S.? With only 100 days left before it beings, the 2026 World Cup in North America is facing a lot of uncertainty.","With only 100 days to go before the FIFA World Cup, what should have been a period of celebration is turning instead into one of turmoil.
The U.S. and Israel attacks on Iran have raised major questi… [+7353 chars]",2026-03-03T21:50:04Z,Iran Israel India,https://www.npr.org/2026/03/03/nx-s1-5733993/fifa-world-cup-iran-war-us-canada-mexico
The New Yorker,"Iran’s Desperate, High-Risk Survival Strategy","Iran knows it likely cannot win the current war, but the regime in Tehran can certainly globalize the pain of the conflict. Ishaan Tharoor on Iran’s asymmetrical warfare.","Israel and the U.S. dont seem that interested in the rules of the game, either. They are launching bombardments across a wide swath of Iran, which have killed at least twelve hundred and thirty peopl… [+4458 chars]",2026-03-06T11:00:00Z,Iran Israel India,https://www.newyorker.com/news/the-lede/irans-desperate-high-risk-survival-strategy
The New Yorker,How Putin Views Trump’s War in Iran,"Russia’s President is profiting from rising oil prices, but he’s also facing a hard new reality: he’s no longer the lead disruptor of the postwar global order.","Still, Khameneis death represented Russias third loss of an important geopolitical client in a little over a year: in December, 2024, Bashar al-Assad, a longtime Russian ally, whom the Kremlin had pr… [+4612 chars]",2026-03-11T19:19:37Z,Iran Israel India,https://www.newyorker.com/news/the-lede/how-putin-views-trumps-war-in-iran
Al Jazeera English,Is BRICS bloc divided over US-Israel attacks on Iran?,"Since India took over as chair, the normally outspoken BRICS grouping appears to be more cautious.","Nearly a week into the United States-Israel war on Iran and the BRICS bloc, a multi-country alliance that includes Tehran, has not reacted in any form to the conflict.
To analysts and political obse… [+10834 chars]",2026-03-06T09:16:36Z,Iran Israel India,https://www.aljazeera.com/news/2026/3/6/is-brics-bloc-divided-over-us-israel-attacks-on-iran
Al Jazeera English,"Modi’s Israel visit: Timeline of India’s relations with Israel, Palestine","From Mahatma Gandhi's support for Palestine to Modi's Netanyahu embrace, how India's ties have evolved over the decades.","Indian Prime Minister Narendra Modi is scheduled to begin his two-day visit to Israel on February 25, nine years after his first trip to the country.
His 2017 trip was the first ever by an Indian pr… [+16317 chars]",2026-02-22T08:25:52Z,Iran Israel India,https://www.aljazeera.com/news/2026/2/22/modis-israel-visit-timeline-of-indias-relations-with-israel-palestine
Al Jazeera English,How Israel-US war on Iran puts $50bn in Indian remittances at risk,"The US-Israel war on Iran has caused gas shortages, while nine million Indian expats in the Gulf face uncertainty.","As the United States-Israeli war on Iran completes two weeks, it has triggered a global energy crisis, even as Irans retaliation threatens to pull the rest of the Middle East into the conflict.
The … [+9550 chars]",2026-03-13T06:06:24Z,Iran Israel India,https://www.aljazeera.com/news/2026/3/13/how-israel-us-war-on-iran-puts-50bn-in-indian-remittances-at-risk
Al Jazeera English,Protests across India against Khamenei’s killing,Protests erupt across India after Ayatollah Ali Khamenei is killed in US-Israeli air strikes on Iran.,"Protests have erupted in several parts of India following the killing of Irans Supreme Leader Ayatollah Ali Khamenei in a United States-Israeli air assault on Iran on Saturday.
Thousands of people t… [+596 chars]",2026-03-02T17:11:58Z,Iran Israel India,https://www.aljazeera.com/gallery/2026/3/2/protests-across-india-against-khameneis-killing
Al Jazeera English,"War on Iran: Can fuel rationing, remote work, short sleeves ease oil woes?",Rising oil prices amid the US-Israel war on Iran are pushing nations to readjust their energy policies.,"The US-Israel war on Iran has rattled global energy markets, as countries scramble to secure fuel, conserve supplies and rethink exports.
Tehran has effectively halted most traffic through the Strai… [+6026 chars]",2026-03-16T11:10:59Z,Iran Israel India,https://www.aljazeera.com/news/2026/3/16/war-on-iran-can-fuel-rationing-remote-work-short-sleeves-ease-oil-woes
Al Jazeera English,"India’s Modi visits Israel: What’s on the agenda, and why it matters",India's prime minister is expected to discuss upgrading security and economic agreements amid rising regional tensions.,"Indian Prime Minister Narendra Modi will begin a two-day visit to Israel on Wednesday. Modis first trip to Israel was in 2017, when he was the first Indian leader to ever visit the country.
India wa… [+9117 chars]",2026-02-25T05:16:17Z,Iran Israel India,https://www.aljazeera.com/news/2026/2/25/indias-modi-visits-israel-whats-on-the-agenda-and-why-it-matters
Al Jazeera English,"India-Israel axis: What are the IMEC corridor, I2U2 grouping Modi spoke of?","During his Knesset speech in Jerusalem, Modi mentioned multilateral projects on which India and Israel collaborate.","Indian Prime Minister Narendra Modi has delved into the history of the relationship between India and Israel, which has improved exponentially since 2014 when he came to power, as he addressed the Kn… [+6481 chars]",2026-02-26T13:48:20Z,Iran Israel India,https://www.aljazeera.com/news/2026/2/26/india-israel-axis-what-are-the-imec-corridor-i2u2-grouping-modi-spoke-of
Al Jazeera English,Why Indian PM Modi’s Israel visit matters for Pakistan’s security,"The tightening strategic embrace between New Delhi and Tel Aviv could test Pakistan's diplomacy, say analysts.","Islamabad, Pakistan  When Indian Prime Minister Narendra Modi stepped off the plane in Tel Aviv on Wednesday for his second visit to Israel, and the first by any Indian premier since his own landmark… [+8369 chars]",2026-02-25T13:14:19Z,Iran Israel India,https://www.aljazeera.com/news/2026/2/25/why-indian-pm-modis-israel-visit-matters-for-pakistans-security
Business Insider,"These airlines are sending rescue flights to the Middle East, where thousands of travelers remain stuck","Although these flights don't always take travelers all the way home, they offer a crucial escape from limbo.","Several airlines are flying select flights to and from the UAE.Flightradar24
<ul><li>The UAE has partially opened its skies, allowing airlines to pick up stranded travelers.</li><li>Most airlines' r… [+6000 chars]",2026-03-05T18:58:51Z,Iran Israel India,https://www.businessinsider.com/these-airlines-are-sending-rescue-flights-to-the-middle-east-2026-3
Al Jazeera English,"How Modi ‘broke down walls’ between India, Israel – at Palestine’s expense","Under Modi, India, a long supporter of the Palestinian cause, has found a friend in Israel's Netanyahu despite genocide.","New Delhi, India As Indian Prime Minister Narendra Modi emerged from his plane at Ben Gurion airport outside Tel Aviv on July 4, 2017, his Israeli counterpart, Benjamin Netanyahu, waited for him at t… [+10321 chars]",2026-02-23T05:20:14Z,Iran Israel India,https://www.aljazeera.com/features/2026/2/23/how-modi-broke-down-walls-between-india-israel-at-palestines
Theregister.com,"Iran war wreaking havoc on shipping and air cargo, could create global delays","Markets in the Middle East will be affected first and worst
The war against Iran is causing an air and shipping jam, but it will likely have little effect on the global technology market unless the conflict widens significantly, according to analysts.…","The war against Iran is causing an air and shipping jam, but it will likely have little effect on the global technology market unless the conflict widens significantly, according to analysts.
UAE is… [+4286 chars]",2026-03-02T22:55:49Z,Iran Israel India,https://www.theregister.com/2026/03/02/iran_war_tech_supply_chain/
The Indian Express,"Iran-Israel War: Air India deploys widebody aircraft to Jeddah, Dubai to repatriate stranded passengers",Iran-Israel war latest update: Air India has deployed wide-body aircraft with higher passenger capacity on its services to Jeddah and Dubai to facilitate the return of stranded passengers from Middle East nations amid the ongoing war between Iran and Israel.,Iran-Israel war latest update: Air India has deployed wide-body aircraft with higher passenger capacity on its services to Jeddah and Dubai to facilitate the return of stranded passengers from Middle… [+1490 chars],2026-03-03T16:09:41Z,Iran Israel India,https://indianexpress.com/article/india/iran-israel-war-air-india-deploys-widebody-aircraft-to-jeddah-dubai-to-repatriate-stranded-passengers-10563392/
Al Jazeera English,"Airspace closed, airlines halt flights as US, Israel attack, Iran responds","At least eight countries, including Iran, Israel, Jordan and Qatar, shutter airspace as global air travel severely hit.","A wave of United States and Israeli strikes on Iran, and retaliation by Tehran, have triggered an outburst of regional violence, forcing much of the Middle Easts airspace to shut down and reverberati… [+2058 chars]",2026-02-28T11:32:36Z,Iran Israel India,https://www.aljazeera.com/news/2026/2/28/airspace-closed-airlines-halt-flights-as-us-israel-attack-iran-responds
The Atlantic,If You Hate Dubai,"Dubai has welcomed residents from practically everywhere on Earth, and its openness stands in defiant contrast with Iran.","On Friday morning, an explosion shook the Dubai International Financial Centre, the United Arab Emirates’ equivalent of Wall Street. According to Dubai authorities, air defenses shot an Iranian drone… [+8919 chars]",2026-03-15T11:00:00Z,Iran Israel India,https://www.theatlantic.com/ideas/2026/03/dubai-iran-us-war/686372/
The Indian Express,"Amid Middle East crisis, Air India, SpiceJet cancel flights again, aviation ministry issues helpline numbers","Flights cancelled today 02 March 2026 as Air India, SpiceJet, Akasa Air and other carriers suspend services due to US-Israel-Iran war, airspace closures & airport shutdowns.","With crisis widening in Middle East, most of the airlines have renewed suspension of their flight operations to and from the countries in the region. The Passenger Assistance Control Room (PACR) at M… [+4241 chars]",2026-03-02T03:31:19Z,Iran Israel India,https://indianexpress.com/article/business/aviation/middle-east-crisis-air-india-spicejet-indigo-akasa-air-flights-cancelled-aviation-ministry-helpline-10560324/
Al Jazeera English,"Iran blames US, Israel for Hormuz tensions as crisis risks energy supplies",Iran's Araghchi calls for global condemnation of ‘military aggression’ that disrupted transit through Strait of Hormuz.,"Irans Foreign Minister Abbas Araghchi has blamed the United States-Israel war for disruptions to shipping in the Strait of Hormuz, the critical global artery through which one-fifth of the worlds oil… [+3109 chars]",2026-03-17T13:03:47Z,Iran Israel India,https://www.aljazeera.com/news/2026/3/17/iran-blames-us-israel-for-hormuz-tensions-as-crisis-risks-energy-supplies
Al Jazeera English,How US sinking of Iranian warship blew hole in Modi’s ‘guardian’ claims,"India sees itself a security provider in the Indian Ocean. On Wednesday, it couldn't save even its own guest.","New Delhi, India Dressed in a blue Navy uniform and sleek sunglasses, Indian Prime Minister Narendra Modi, in late October, addressed a gathering of the countrys sea warriors.
He listed out the stra… [+8711 chars]",2026-03-06T01:09:29Z,Iran Israel India,https://www.aljazeera.com/features/2026/3/6/how-us-sinking-of-iranian-warship-blew-hole-in-modis-guardian-claims
Al Jazeera English,T20 World Cup teams stuck in India because of Middle East travel chaos,"West Indies and Zimbabwe remain in India, along with the semifinalists at the India and Sri Lanka-cohosted World Cup.","The West Indies and Zimbabwe cricket squads and support staff at the ICC Mens T20 World Cup 2026 have been stranded in India, unable to leave because of airspace closures and travel chaos caused by t… [+1743 chars]",2026-03-03T12:00:52Z,Iran Israel India,https://www.aljazeera.com/sports/2026/3/3/t20-world-cup-cricket-teams-stuck-in-india-because-of-travel-chaos
The Indian Express,Iran-Israel tensions disrupt air travel: 444 flights likely to be cancelled across India today,"Iran-Israel tensions have disrupted Indian flight operations as 444 services face cancellations, with the MoCA and DGCA coordinating passenger assistance and airline compliance.","Indias civil aviation authorities are bracing for widespread disruption as tensions between Iran and Israel spill over into regional airspace operations, prompting hundreds of flight cancellations.Th… [+2463 chars]",2026-03-01T02:13:56Z,Iran Israel India,https://indianexpress.com/article/india/iran-israel-tensions-444-flights-cancelled-india-10558479/
The Indian Express,‘Deeply concerned’: India urges restraint after Israel-US strikes on Iran,"The US and Israel launched a military operation against Iran, a day after negotiations over Tehran’s nuclear enrichment programme concluded in Geneva without a breakthrough.","Amid escalating military tensions in the Middle East, the Ministry of External Affairs (MEA) Saturday issued a statement urging all parties involved to exercise restraint and prioritise the safety of… [+2079 chars]",2026-02-28T15:00:34Z,Iran Israel India,https://indianexpress.com/article/india/mea-statement-iran-israel-war-operation-lions-roar-indian-nationals-advisory-10557887/
Al Jazeera English,What’s Netanyahu’s planned ‘hexagon’ alliance – and can it work?,Analysts call PM Benjamin Netanyahu’s alliance pitch a 'fantasy world' as Israel faces growing international isolation.,"Israels Prime Minister Benjamin Netanyahu has outlined plans to form a new regional bloc, and has framed the Middle East as divided into radical Sunni and Shia axes.
Speaking on Sunday, Netanyahu de… [+8949 chars]",2026-02-23T16:14:52Z,Iran Israel India,https://www.aljazeera.com/news/2026/2/23/whats-netanyahus-planned-hexagon-alliance-and-can-it-work
The New York Review of Books,A Bitter Education,"In its quiescence to the West’s war on Iran, India is squandering a precious legacy.","Jawaharlal Nehru wrote in The Discovery of India that “among the many people and races who have come in contact with Indians and influenced India’s life and culture, the oldest and most persistent ha… [+9572 chars]",2026-03-13T12:00:00Z,Iran Israel India,http://www.nybooks.com/articles/2026/04/09/a-bitter-education-iran-pankaj-mishra/
Al Jazeera English,Netanyahu says Israel will forge regional alliance to rival ‘radical axes’,Israeli PM says his country is working to counter what he called 'radical Shia axis' and 'emerging radical Sunni axis'.,Israeli Prime Minister Benjamin Netanyahu has announced that Israel plans to build a network of allied nations in or around the Middle East to collectively stand against what he called radical advers… [+2414 chars],2026-02-22T18:20:41Z,Iran Israel India,https://www.aljazeera.com/news/2026/2/22/netanyahu-says-israel-will-forge-regional-alliance-to-rival-radical-axis
The Indian Express,Must work in mission mode to emerge as global hub of indigenous drone manufacturing: Rajnath,"Citing the ongoing Russia-Ukraine and Iran-Israel conflicts, the Defence Minister said indigenous drone production ecosystem is a must for strategic autonomy, defence preparedness and self-reliance","Stressing on the urgent need to build a drone-production ecosystem in the country to ensure strategic autonomy, Defence Minister Rajnath Singh on Thursday said India must work in a mission mode to em… [+3804 chars]",2026-03-19T13:01:16Z,Iran Israel India,https://indianexpress.com/article/india/global-hub-drone-manufacturing-mission-mode-rajnath-singh-10590751/
Al Jazeera English,Turkish ‘threat’ talked up in Israel as Netanyahu focuses on new alliances,Relations between Israel and Turkiye continue to deteriorate amid accusations and heightened geopolitical tensions.,"With the likelihood increasing of a United States attack on Iran, Israeli politicians are already turning their attention to another regional rival: Turkiye.
Former Israeli Prime Minister Naftali Be… [+7184 chars]",2026-02-23T18:35:33Z,Iran Israel India,https://www.aljazeera.com/news/2026/2/23/turkish-threat-talked-up-israel-netanyahu-focuses-new-alliances
Zetter-zeroday.com,Iranian Hacktivists Strike Medical Device Maker Stryker and Wiped Systems,"Stryker, a leading maker of medical devices, was hit early this morning with a cyberattack that has reportedly caused the company's systems to shut down globally. The company has acknowledged the attack and called it ""severe"" in communication with employees.
…","Stryker, a leading maker of medical devices, was hit early this morning with a cyberattack that has reportedly caused the company's systems to shut down globally. The company has acknowledged the att… [+4841 chars]",2026-03-12T13:54:56Z,Iran Israel India,https://www.zetter-zeroday.com/iranian-hacktivists-strike-medical-device-maker-stryker-in-severe-attack-that-wiped-systems/
Al Jazeera English,Iran war: What is happening on day 15 of US-Israel attacks?,US hits Iran’s Kharg island as it warns oil sites may be next if Tehran disrupts shipping through the Strait of Hormuz.,"The United States-Israel war on Iran, now in its third week, continues to escalate after US forces struck military targets on Kharg Island, the critical hub through which most of Irans crude exports … [+7592 chars]",2026-03-14T05:45:46Z,Iran Israel India,https://www.aljazeera.com/news/2026/3/14/iran-war-what-is-happening-on-day-15-of-us-israel-attacks
The Indian Express,Why gold prices have remained subdued in India despite raging West Asian conflict,"While geopolitical uncertainty usually shores up safe haven demand and leads to a rally in gold prices, this time round gold prices have remained relatively flat since the US and Israel commenced their war on Iran","Gold dealers and refiners in India are offering discounts of up to $80 per ounce as jewellery demand remains weak due to high prices, disruption to flight services and a strong dollar, even as the wa… [+4763 chars]",2026-03-16T03:38:10Z,Iran Israel India,https://indianexpress.com/article/explained/explained-economics/gold-price-discount-india-bullion-demand-weak-10584155/
