source,title,description,content,published_at,keyword_used,url
The Indian Express,How an Iranian dancer is reclaiming a women’s only art form,"When she started teaching belly dancing in Pune more than 15 years ago, there were many questions. “You will see in Arabic countries that people have a belly dancer at weddings. In India, sadly, it's looked down upon,” she says.","Women dancers stand in clusters of rows and columns. They are almost all Indians, but each is drawn to an art form that originated in the Middle East and is taught to them by an Iranian teacher. As t… [+4189 chars]",2026-03-07T14:05:00Z,Iran Israel India,https://indianexpress.com/article/pune/how-an-iranian-dancer-is-reclaiming-a-womens-only-art-form-10570173/
The Indian Express,3 Indians feared dead in attacks off Oman coast,"The Embassy of India in Oman expressed its “deepest condolences” on the demise of the Indian crew member on board MKD Vyom. The tanker, flagged to the Republic of the Marshall Islands, was carrying an estimated 59,463 metric tons of cargo.","THREE INDIAN nationals are believed to have lost their lives in two separate incidents during the ongoing Iran-Israel conflict, owing to attacks by the Iranian side on merchant shipping vessels off t… [+2405 chars]",2026-03-03T18:55:49Z,Iran Israel India,https://indianexpress.com/article/india/3-indians-feared-dead-in-attacks-off-oman-coast-10563787/
Al Jazeera English,Where do the 35 million foreigners living in the GCC come from?,More than half of the 62 million people in the six Gulf Cooperation Council (GCC) countries are foreign workers.,"Nearly 62 million people living in the six Gulf Cooperation Council (GCC) countries have been caught in the crossfire of the latest US-Israel war on Iran.
Known for their economic opportunities, the… [+4991 chars]",2026-03-09T22:20:17Z,Iran Israel India,https://www.aljazeera.com/news/2026/3/9/where-do-the-35-million-foreigners-living-in-the-gcc-come-from
Al Jazeera English,"Why are Iran’s South Pars gasfield, Qatar’s Ras Laffan, so significant?","Israel's strike on South Pars and Iran's attack on Ras Laffan escalate energy crisis, deepen regional tensions.","In a move which has shifted the US-Israel war on Iran up a gear, Israel struck Irans critical South Pars gasfield on Wednesday. Soon after, Iran hit energy facilities across the Gulf region, includin… [+8048 chars]",2026-03-19T12:47:57Z,Iran Israel India,https://www.aljazeera.com/economy/2026/3/19/why-are-irans-south-pars-gasfield-qatars-ras-laffan-so-significant
Skift,Indian Hotels’ Cooking Gas Shut Off By Iran War,A combination of the Iran war and India’s reliance on imported fuel is shutting down hotel kitchens and train galleys while sending up airline ticket prices.,"Lavish buffet breakfasts are being trimmed down and restaurant menu items are being crossed out as hotels across India try to withstand a sudden fuel shortage, according to hospitality operators. 
S… [+738 chars]",2026-03-12T12:30:46Z,Iran Israel India,https://skift.com/2026/03/12/indian-hotels-cooking-gas-oil-iran-war/
Al Jazeera English,Trump says some sanctions to be lifted on oil producers amid Iran war,Crude oil prices plunge below $90 a barrel following an earlier surge to almost $120 in price swing over 24 hours.,"United States President Donald Trump has said his administration will lift some sanctions on oil-producing countries to keep energy prices down amid the US and Israels war on Iran.
Trump made the co… [+2965 chars]",2026-03-10T02:51:58Z,Iran Israel India,https://www.aljazeera.com/economy/2026/3/10/trump-says-some-sanctions-to-be-lifted-on-oil-producers-amid-iran-war
Democracy Now!,"""Iran Is Not Going to Surrender"": Johns Hopkins Prof. Says U.S. and Israel Underestimate Iran","The U.S.-Israeli war on Iran is now in its fifth day. Following the assassination of Supreme Leader Ali Khamenei, Israel has made it clear that it intends to target any official successors. Observers also warn that Israel could soon deploy its “Dahiya doctrin…","AMYGOODMAN: This is Democracy Now!, democracynow.org. I’m Amy Goodman.
Israel has launched another wave of airstrikes against Iran, with loud blasts reported in Tehran this morning. As the U.S.-Isra… [+9310 chars]",2026-03-04T13:23:53Z,Iran Israel India,https://www.democracynow.org/2026/3/4/narges_bajoghli
Al Jazeera English,Top Trump adviser says Iran war price tag at $12bn so far,Pressure grows on the US president's administration as war costs spiral and the mission's endgame remains unclear.,"The United States has spent $12bn on its war against Iran since launching joint strikes on the country with Israel on February 28, Trumps top economic adviser said, as domestic concerns grow over the… [+2591 chars]",2026-03-15T23:34:06Z,Iran Israel India,https://www.aljazeera.com/news/2026/3/15/top-trump-advisor-says-iran-war-price-tag-at-approximately-12bn-so-far
Skift,How Indian Travel Players are Navigating the U.S.-Iran Attack in Middle East,"India's immediate west is now engulfed in an international armed conflict. Even as operations have partially resumed, a prolonged escalation will not only threaten India's connectivity, but will also have a sharp effect on its growing aviation sector.",The ongoing tensions in the Middle East following the attack by the U.S. and Israel on Iran has led to travel players in India scrambling to keep up. While India is itself not a part of the armed con… [+757 chars],2026-03-02T17:43:40Z,Iran Israel India,https://skift.com/2026/03/02/how-indian-travel-players-are-navigating-the-u-s-iran-attack-in-middle-east/
The Indian Express,"From the Urdu Press: ‘US court cut Donald Trump down to size, politics of polarisation in West Bengal’","Urdu dailies weighed in on US court halting Donald Trump’s massive trade tariffs, and focussed on its implications for Trump and the world at large.",The US Supreme Courts order halting President Donald Trumps massive trade tariffs has not only brought a sense of vindication amongst his opponents but also evoked scathing editorials in dailies acro… [+3824 chars],2026-02-25T08:11:06Z,Iran Israel India,https://indianexpress.com/article/political-pulse/from-the-urdu-press-us-court-donald-trump-politics-polarisation-west-bengal-10551264/
The Indian Express,Turmoil in West Asia denies woman from Punjab village wave final goodbye to son,Binder Masih from Jalandhar’s Akbarpur Kalan village flight to India to attend son’s final rites cancelled,"The escalating conflict involving Iran, the United States and Israel has left behind not just geopolitical tremors but also personal tragedies. A woman from Akbarpur Kalan village near Nakodar in Pun… [+3484 chars]",2026-03-03T16:42:20Z,Iran Israel India,https://indianexpress.com/article/cities/chandigarh/turmoil-in-west-asia-denies-woman-from-punjab-village-wave-final-goodbye-to-son-10563590/
Al Jazeera English,Iran’s Women’s Asian Cup team have ‘so much concern’ for families back home,Players contesting the Women's Asian Cup in Australia share fears for loved ones at home amid US-Israeli attacks.,"Iran coach Marziyeh Jafari says her team fear for their families at home as war rages, with players fully disconnected from them during the Womens Asian Cup.
The Iranian team are preparing to face h… [+3255 chars]",2026-03-04T10:37:53Z,Iran Israel India,https://www.aljazeera.com/sports/2026/3/4/irans-womens-asian-cup-team-have-so-much-concern-for-families-back-home
The New Republic,Trump Just Made the World Much More Dangerous,"The United States and Israeli strikes against Iran began only hours ago, but there’s already one clear lesson for the rest of the world: If you have a nuclear weapon, you are safe from potential U.S. attack, and if you don’t have a nuclear weapon, you are vul…","The United States and Israeli strikes against Iran began only hours ago, but theres already one clear lesson for the rest of the world: If you have a nuclear weapon, you are safe from potential U.S. … [+1802 chars]",2026-02-28T15:59:01Z,Iran Israel India,https://newrepublic.com/article/207182/trump-iran-attack-nuclear-weapons-proliferation
The Times of India,Global Market Today | Asian stocks edge higher at open as oil retreats,Asian markets opened higher on Friday. This followed a rebound in US stocks and a drop in oil prices. Leaders from the US and Israel are working to ease worries about the Iran war. Investors are closely watching geopolitical developments for signs of de-escal…,Asian equities advanced at the open Friday after US stocks rebounded from session lows and oil retreated amid efforts by leaders of the US and Israel to calm concerns over the Iran war.The MSCI Asia … [+2863 chars],2026-03-20T01:04:43Z,Iran Israel India,https://economictimes.indiatimes.com/markets/us-stocks/news/asian-stocks-edge-higher-at-open-as-oil-retreats/articleshow/129690138.cms
Al Jazeera English,Geopolitical analysis of the imposed war against Iran,This is a war of survival and global consequences.,"In the second week of the war against Iran, it has gone beyond a local conflict, with ramifications reaching the global level. This conflict, aggressively and illegally imposed by the United States a… [+6015 chars]",2026-03-10T09:02:50Z,Iran Israel India,https://www.aljazeera.com/opinions/2026/3/10/geopolitical-analysis-of-the-imposed-war-against-iran
Al Jazeera English,Trump calls for naval coalition to open Strait of Hormuz: Can it work?,Analysts say US president's solution to secure the strait is fraught with problems.,"United States President Donald Trump has called for a naval coalition to deploy warships to secure the Strait of Hormuz, through which one-fifth of world oil shipments transit, as oil markets reel fr… [+8718 chars]",2026-03-15T14:56:12Z,Iran Israel India,https://www.aljazeera.com/news/2026/3/15/trump-calls-for-naval-coalition-to-open-strait-of-hormuz-can-it-work
RT,India’s ties with Israel ‘unfortunate’ – Iran,"Iran doesn’t find it appropriate to deal with a “genocidal regime,” Foreign Minister Abbas Araghchi has said Read Full Article at RT.com","Iran considers India’s ties with Israel to be “unfortunate,” Tehran’s foreign minister has said.
Abbas Araghchi told an Indian television channel on Wednesday that Tehran does not find it appropriat… [+1592 chars]",2026-02-26T11:57:43Z,Iran Israel India,https://www.rt.com/india/633069-indias-ties-with-israel-unfortunate/
The Times of India,"West Asia tensions rattle capital goods stocks; L&T, KEC slide","Engineering and capital goods stocks are under pressure due to the Iran-Israel conflict, with the BSE Capital Goods index falling nearly 4%. Companies like Larsen & Toubro and KEC International face potential project cancellations and execution delays, impact…",ET Intelligence Group: The stocks of engineering and capital goods companies having exposure to the West Asia are under pressure since February 27 amid the conflict between Iran and Israel. The BSE C… [+2572 chars],2026-03-05T00:44:48Z,Iran Israel India,https://economictimes.indiatimes.com/markets/stocks/news/west-asia-tensions-rattle-capital-goods-stocks-lt-kec-slide/articleshow/129059405.cms
CBC News,"Israel says it killed Iranian militia head, security chief amid 'wide-scale' strikes on Tehran","Israel's defence minister said that its military killed Iran's security chief and the head of its Basij militia in overnight airstrikes as it conducted  a ""wide-scale wave of strikes"" across Tehran on Tuesday.","Israel's defence minister said that its military killed Iran's security chief and the head of its Basij militia in overnight airstrikes as it conducted a ""wide-scale wave of strikes"" across Tehran on… [+7254 chars]",2026-03-17T08:52:33Z,Iran Israel India,https://www.cbc.ca/news/world/israel-strikes-tehran-lebanon-9.7131401
Al Jazeera English,IEA announces release of 400 million barrels of oil. But is it enough?,Global energy watchdog pledges largest release from oil reserves amid war on Iran. But is 'one-shot' tactic sufficient?,"The International Energy Agency (IEA), a global energy watchdog, with several of the wealthiest countries as member nations, has announced the largest release of government oil reserves in its histor… [+11794 chars]",2026-03-13T13:08:07Z,Iran Israel India,https://www.aljazeera.com/news/2026/3/13/iea-announces-release-of-400-million-barrels-of-oil-but-is-it-enough
The Indian Express,"US-Israel vs Iran war: US destroys 17 Iranian vessels as Saudi, UAE intercept drones; Middle East tensions soar","Trump claimed that Tehran wanted negotiations but that it was “too late”, as US military operations continued.","The conflict in the Middle East has intensified in the last 24 hours across multiple fronts indicating a dangerous escalation in the US-Israel vs Iran war. The US has struck more than 1,700 targets u… [+6407 chars]",2026-03-04T06:10:20Z,Iran Israel India,https://indianexpress.com/article/world/us-israel-vs-iran-conflict-whatshappening-in-the-middle-east-10564235/
Juancole.com,The Israel-US and Iran War: A Geostrategic Transformation,"Iran has also declared that financial centers, banks, and offices of major technology companies could be the next targets.","( Middle East Monitor ) – After the 12-day war in May last year, it was clear that both sides would be face-to-face soon. They restarted on 28th February 2026. Israel-US adopted the same pattern of t… [+10983 chars]",2026-03-14T04:06:52Z,Iran Israel India,https://www.juancole.com/2026/03/israel-geostrategic-transformation.html
Wired,What Happens if Iran Shuts Down the Strait of Hormuz?,The Strait of Hormuz is one of the most sensitive pressure points in the global economy. Conflict in Iran could put it at risk indefinitely.,"The analysis company's Commodities at Sea monitoring also recorded outbound oil and product flows averaging about 20.4 million barrels per day in February to date, slightly below January levelseviden… [+2828 chars]",2026-03-01T15:31:22Z,Middle East conflict India,https://www.wired.com/story/what-happens-if-iran-shuts-down-the-strait-of-hormuz/
Yahoo Entertainment,Induction stoves fly off shelves in India as gas shortage fears spark panic buying,"By Praveen Paramasivam CHENNAI, March 12 (Reuters) - Indian households are rushing to buy electric induction stoves, draining stocks online and in stores...","By Praveen Paramasivam
CHENNAI, March 12 (Reuters) - Indian households are rushing to buy electric induction stoves, draining stocks online and in stores, amid fears of a potential cooking gas short… [+2414 chars]",2026-03-12T13:37:56Z,Middle East conflict India,https://sg.finance.yahoo.com/news/induction-stoves-fly-off-shelves-133756964.html
Slashdot.org,"Strait of Hormuz Closure Triggers Work From Home, 4-Day Weeks In Asia","Asian governments are implementing emergency measures like four-day workweeks and work-from-home mandates to cope with a fuel shortage triggered by the Iran conflict and the closure of the Strait of Hormuz. ""Asia is particularly dependent on oil exports from …","On March 10, Thailand ordered civil servants to take the stairs rather than the elevator, and to work-from-home for the duration of the crisis. It increased the air-conditioning temperature to 27 deg… [+858 chars]",2026-03-12T15:00:00Z,Middle East conflict India,https://news.slashdot.org/story/26/03/12/0710204/strait-of-hormuz-closure-triggers-work-from-home-4-day-weeks-in-asia
Lloydslist.com,They all said Hormuz closure would be brief. What if they were wrong?,"On day six of the Middle East war, hope of a swift reopening of the Strait of Hormuz is fading. There does not seem to be a quick fix. A material return of transits in the future will require shipowners to be convinced that the route is safe for their crew an…","FOR MANY years, shipowners on panels and quarterly calls have been asked: What happens if the Strait of Hormuz closes? The response was almost always the same: if it ever happens, the closure will be… [+11002 chars]",2026-03-08T01:46:05Z,Middle East conflict India,https://www.lloydslist.com/LL1156532/They-all-said-Hormuz-closure-would-be-brief-What-if-they-were-wrong
Sky Sports,Will Iran play at World Cup co-hosted by USA? How Middle East crisis affects sport,"With the conflict between Iran and US-Israeli forces intensifying, Sky Sports looks at how the Middle East crisis is affecting sport...","With the conflict between Iran and US-Israeli forces intensifying, Sky Sports looks at how the Middle East crisis is affecting sport...
Football
Iran's participation in the World Cup has been calle… [+8581 chars]",2026-03-02T17:31:00Z,Middle East conflict India,https://www.skysports.com/football/news/12098/13514357/middle-east-crisis-will-iran-play-at-world-cup-co-hosted-by-usa-how-conflict-affects-sport
The Indian Express,"Sensex crashes over 2,000 points as crude oil prices cross $115/barrel on Middle East conflict","The NSE’s Nifty 50 index is down 686.85 points or 2.8% at 23,663.60 points at around 10:30 AM, the lowest level since April 2025 when US President Donald Trump had first announced reciprocal tariffs.","The benchmark stock indices crashed 3% early on Monday as the war in the Middle East stretched for a second week, which resulted in crude oil prices crossing the $115 mark for the first time since Ru… [+2943 chars]",2026-03-09T04:46:14Z,Middle East conflict India,https://indianexpress.com/article/business/market/sensex-drops-3-nifty-at-23741-amid-global-sell-off-and-rising-crude-oil-prices-10572421/
BBC News,Sciver-Brunt returns from England training camp,Captain Nat Sciver-Brunt returns from England’s training camp in South Africa for family reasons.,"Captain Nat Sciver-Brunt has returned from England's training camp in South Africa for family reasons.
Sciver-Brunt is not expected to return to Pretoria, where England are playing an intra-squad se… [+601 chars]",2026-03-19T11:38:34Z,Middle East conflict India,https://www.bbc.com/sport/cricket/articles/cm25nngym5mo
BBC News,Windies book own flights after 'distressing' wait,"The West Indies team is to return home via commercial flights from India after a ""distressing"" wait following their exit from the men's T20 World Cup.","The West Indies team is to return home via commercial flights from India after a ""distressing"" wait following their exit from the men's T20 World Cup.
West Indies have been stuck in Kolkata since th… [+1423 chars]",2026-03-10T17:57:20Z,Middle East conflict India,https://www.bbc.com/sport/cricket/articles/clygr0y9yrgo
The Indian Express,War in the Middle East: Sigh of relief as many return home from Abu Dhabi,The Delhi airport on Monday saw 87 flight cancellations. Delhi airport operator DIAL said there are delays or schedule changes for some West-bound international flights.,"Shiv Sharma (26), a business analyst in Manchester, was at the aerobridge, waiting in queue to board his connecting flight from Abu Dhabis Zayed International Airport (AUH) to Delhis IGI Airport on S… [+3139 chars]",2026-03-02T23:24:25Z,Middle East conflict India,https://indianexpress.com/article/cities/delhi/war-in-the-middle-east-sigh-of-relief-as-many-return-home-from-abu-dhabi-10561922/
RT,Middle East crisis: India reacts to a festering conflict,"Oil prices, energy security and foreign policy nuances dominate the Indian discourse on the crisis in the Persian Gulf Read Full Article at RT.com","As the Middle East crisis escalates in the aftermath of the US-Israeli attacks on Iran and Tehran’s retaliatory strikes, a cross-section of the Indian public has expressed its opinion on diverse issu… [+5156 chars]",2026-03-04T13:44:52Z,Middle East conflict India,https://www.rt.com/india/633769-middle-east-crisis-india-reacts/
The Times of India,Rupee may slip further if Middle East tensions persist: Naveen Mathur,The Indian rupee is under pressure due to global geopolitical tensions and soaring crude oil prices. Currency markets are watching the Reserve Bank of India's next move. Traders expect continued volatility as the dollar strengthens and oil import demand rises…,"The Indian rupee remains under pressure amid escalating geopolitical tensions and a sharp surge in global crude oil prices, with currency markets closely watching the next move by the Reserve Bank of… [+3711 chars]",2026-03-09T07:27:17Z,Middle East conflict India,https://economictimes.indiatimes.com/markets/expert-view/rupee-may-slip-further-if-middle-east-tensions-persist-naveen-mathur/articleshow/129318632.cms
Skift,"5x, 10x, 20x – Airlines Hike Ticket Prices Out of Middle East","When a crisis hits, people crave comfort and stability. But for those caught in the Middle East conflict, with over 55% of flights canceled, a fare home came with a hefty price tag.","Airlines have been charging people stranded in the Middle East up to 20x a normal fare to get out of the Gulf amid the Iran war.
Passengers tell Skift they have been at the mercy of airlines and fee… [+733 chars]",2026-03-13T16:18:08Z,Middle East conflict India,https://skift.com/2026/03/13/iran-war-airline-flight-price-increases/
Vox,Why India switched sides on Israel-Palestine — and why it matters,"This past week, we got a vision of what the future of world politics might look like. And it wasn’t pretty. The glimpse came during Indian Prime Minister Narendra Modi’s visit to Israel, in which he signed an expansive defense cooperation agreement and gave a…","Indian Prime Minister Narendra Modi meets with Prime Minister of Israel Benjamin Netanyahu in New Delhi, India, on February 25, 2026. | Press Information Bureau (PIB)/Anadolu via Getty Images


This… [+7993 chars]",2026-02-27T22:21:22Z,Middle East conflict India,https://www.vox.com/politics/480941/india-israel-modi-visit-2026-palestine-netanyahu
Skift,Indian Airlines Continue To Adjust Routes During Iran War,"As war continues in the Middle East develops, Indian airlines are cautiously working to ensure safety of passengers and crew, without ramping up costs.","Key Points
<ul><li>Indian airlines are rapidly adjusting routes and restoring some international services in response to Middle East airspace closures caused by the conflict involving Iran.</li><li>… [+1017 chars]",2026-03-05T15:42:57Z,Middle East conflict India,https://skift.com/2026/03/05/indian-airlines-middle-east-flight-disruption/
RT,First India-bound tanker arrives after crossing Strait of Hormuz,The Shenlong reportedly cross the Tehran-controlled Strait of Hormuz after the Middle East conflict began Read Full Article at RT.com,"The first India-bound tanker to cross the Strait of Hormuz after the Middle East conflict began has arrived in the country.
The Liberian-flagged Shenlong Suezmax, which carried crude oil from Saudi … [+1863 chars]",2026-03-12T14:07:04Z,Middle East conflict India,https://www.rt.com/india/634680-first-india-bound-tanker-arrives/
Al Jazeera English,From Gaza to defence: Five key takeaways from Indian PM Modi’s Israel visit,Indian PM throws his weight behind Israel's Netanyahu even as genocide continues in occupied Palestinian territory.,"Indian Prime Minister Narendra Modi has wrapped up a two-day visit to Israel, which was marked by a welcoming embrace from his counterpart, Benjamin Netanyahu, and a conspicuous silence about Israels… [+10523 chars]",2026-02-26T15:52:15Z,Middle East conflict India,https://www.aljazeera.com/features/2026/2/26/from-gaza-to-defence-five-key-takeaways-from-indian-pm-modis-israel-visit
RT,Middle East conflict is of ‘particular concern’ to India – Jaishankar,"The region is vital to New Delhi’s energy security, its foreign minister has said. Read Full Article at RT.com",India has called for de-escalating tensions in the Middle East region through dialogue and diplomacy. The region is key to India’s energy security and includes many important suppliers of oil and gas… [+2471 chars],2026-03-09T12:27:07Z,Middle East conflict India,https://www.rt.com/india/634249-middle-east-conflict-is-of/
RT,US ‘unsanctions’ Russian oil amid Middle East crisis,“Unsanctioning” Russian oil may cool the market after the US-Israeli attack on Iran sent global crude prices soaring Read Full Article at RT.com,"Washington has eased sanctions on some volumes of Russian oil to help stabilize global energy markets following the Middle East escalation, US Treasury Secretary Scott Bessent said on Friday in an in… [+2216 chars]",2026-03-07T12:48:36Z,Middle East conflict India,https://www.rt.com/business/634079-us-unsanction-russian-oil-iran/
RT,India increases liquefied petroleum gas production amid Middle East crisis,India has implemented emergency measures to ensure gas supplies for its large population Read Full Article at RT.com,"India has stepped up liquefied petroleum gas (LNG) production in light of the supply disruption caused by the Middle East conflict.
On March 10, New Delhi had invoked special legislation, the Essent… [+1269 chars]",2026-03-18T12:54:57Z,Middle East conflict India,https://www.rt.com/india/635418-india-increases-liquefied-petroleum-gas/
Al Jazeera English,Will the US benefit from the oil crisis sparked by the war on Iran?,Attacks on energy sites in the Gulf and disruptions in the Strait of Hormuz give Western exporters a chance to profit.,"As oil and gas prices soar against the backdrop of the war in Iran, the United States and Western exporters could find a new opportunity to fill the gap in the market.
As the conflict enters its six… [+8524 chars]",2026-03-05T12:59:04Z,Middle East conflict India,https://www.aljazeera.com/news/2026/3/5/will-the-us-benefit-from-the-oil-crisis-sparked-by-the-war-on-iran
